{
  "airportCode": "SEA",
  "airportName": "Seattle-Tacoma International Airport",
  "scheduledDeparture": "2026-04-19T08:30:00-07:00",
  "estimatedDeparture": "2026-04-19T08:30:00-07:00",
  "scheduledArrival": "2026-04-19T11:05:00-07:00",
  "estimatedArrival": "2026-04-19T11:05:00-07:00",
  "gate": "D6",
  "terminal": "S"
}